{
  "$schema": "https://json-schema.org/draft/2020-12/schema",
  "$id": "https://github.com/GeorgeLukaanya/bse4104-procurement-agent/blob/main/docs/architecture/schemas/create_requisition_draft.input.json",
  "title": "create_requisition_draft input",
  "description": "Creates a requisition in DRAFT. `status` is accepted only as the constant \"DRAFT\"; any other value is refused with FORBIDDEN_TRANSITION rather than corrected, because Requirement 14.3 permits no programmatic transition beyond DRAFT.",
  "type": "object",
  "additionalProperties": false,
  "required": [
    "review_date",
    "officer_username",
    "items",
    "justification"
  ],
  "properties": {
    "review_date": {
      "type": "string",
      "pattern": "^\\d{4}-\\d{2}-\\d{2}$"
    },
    "officer_username": {
      "type": "string",
      "minLength": 1,
      "description": "Authenticated username recorded on the requisition. Requirement 9.2."
    },
    "status": {
      "const": "DRAFT",
      "default": "DRAFT",
      "description": "Present only so that an attempt to set anything else is a schema violation with a named cause."
    },
    "items": {
      "type": "array",
      "minItems": 1,
      "items": {
        "type": "object",
        "additionalProperties": false,
        "required": [
          "sku",
          "reorder_quantity",
          "comparison_reference"
        ],
        "properties": {
          "sku": {
            "type": "string",
            "pattern": "^AH-[A-Z]{2}-[0-9]{3}$"
          },
          "reorder_quantity": {
            "type": "integer",
            "exclusiveMinimum": 0
          },
          "comparison_reference": {
            "type": "string",
            "description": "Identifier of the compare_quotations result attached as evidence."
          },
          "recommended_quotation_id": {
            "type": [
              "string",
              "null"
            ],
            "description": "Advisory only. POL-004-C04: a recommendation is not an award."
          },
          "unresolved_issues": {
            "type": "array",
            "items": {
              "type": "string"
            }
          }
        }
      }
    },
    "policy_clauses": {
      "type": "array",
      "items": {
        "type": "string",
        "pattern": "^[A-Z]+-[0-9]{3}-C[0-9]{2}$"
      },
      "description": "Clause identifiers retrieved for these items. Each must exist in the corpus at the cited version."
    },
    "justification": {
      "type": "string",
      "minLength": 1,
      "description": "The officer-confirmed justification. Drafted by the model, confirmed by a human before this call."
    }
  }
}
